{
  "logging": {
    "logLevel": "INFO",
    "enableConsoleOutput": true,
    "enableFileOutput": true,
    "enableProgressBars": true,
    "coloredOutput": true,
    "maxLogSizeMB": 10,
    "logRotation": true,
    "keepLogFiles": 10,
    "enablePerformanceTracking": true,
    "enableStructuredLogging": true,
    "logBufferSize": 1000,
    "flushInterval": 30
  },
  "formatting": {
    "dateTimeFormat": "yyyy-MM-dd HH:mm:ss.fff",
    "messageFormat": "[{timestamp}] [{level}] [{component}] {message}",
    "progressBarStyle": "detailed",
    "includeThreadId": true,
    "includeSessionId": true
  },
  "levels": {
    "DEBUG": {
      "enabled": false,
      "color": "Gray",
      "fileOutput": true,
      "consoleOutput": false
    },
    "INFO": {
      "enabled": true,
      "color": "White",
      "fileOutput": true,
      "consoleOutput": true
    },
    "SUCCESS": {
      "enabled": true,
      "color": "Green",
      "fileOutput": true,
      "consoleOutput": true
    },
    "WARN": {
      "enabled": true,
      "color": "Yellow",
      "fileOutput": true,
      "consoleOutput": true
    },
    "ERROR": {
      "enabled": true,
      "color": "Red",
      "fileOutput": true,
      "consoleOutput": true
    },
    "CRITICAL": {
      "enabled": true,
      "color": "Magenta",
      "fileOutput": true,
      "consoleOutput": true
    }
  },
  "components": {
    "BAT": "Batch Launcher",
    "ORCHESTRATOR": "Main Orchestrator",
    "TYPE1": "Inventory/Reporting",
    "TYPE2": "System Modification",
    "CONFIG": "Configuration Manager",
    "MENU": "Interactive Menu",
    "LOGGING": "Logging Manager",
    "SECURITY": "Security Audit",
    "INVENTORY": "System Inventory",
    "BLOATWARE": "Bloatware Management",
    "APPS": "Essential Apps",
    "UPDATES": "Windows Updates",
    "OPTIMIZATION": "System Optimization",
    "TELEMETRY": "Telemetry Management",
    "DEPENDENCIES": "Dependency Manager",
    "SCHEDULER": "Task Scheduler",
    "REPORTING": "Report Generation"
  },
  "reporting": {
    "enableLogExport": true,
    "exportFormats": ["JSON", "CSV", "XML"],
    "includePerformanceMetrics": true,
    "enableDashboardReports": true,
    "autoGenerateReports": true,
    "reportOutputPath": "temp_files/reports"
  },
  "performance": {
    "trackOperationTiming": true,
    "trackMemoryUsage": false,
    "trackCPUUsage": false,
    "enableAlertThresholds": true,
    "slowOperationThreshold": 30.0,
    "criticalOperationThreshold": 60.0
  },
  "alerts": {
    "enableEmailAlerts": false,
    "enableConsoleAlerts": true,
    "criticalErrorThreshold": 3,
    "warningAccumulationThreshold": 10
  }
}